Authors,Title,Year,Source title,Volume,Issue,Art. No.,Page start,Page end,Page count,DOI,Link,PubMed ID,Document Type,Source
"Bécot A., Volgers C., van Niel G.",Transmissible endosomal intoxication: A balance between exosomes and lysosomes at the basis of intercellular amyloid propagation,2020,Biomedicines,8,8,272,,,,10.3390/BIOMEDICINES8080272,https://www.scopus.com/inward/record.uri?eid=2-s2.0-85089731156&doi=10.3390%2fBIOMEDICINES8080272&partnerID=40&md5=b36c28853df14ae033d3db8d5a7d6b8b,,Review,Scopus
Rilla K.,Diverse plasma membrane protrusions act as platforms for extracellular vesicle shedding,2021,Journal of Extracellular Vesicles,10,11,e12148,,,,10.1002/jev2.12148,https://www.scopus.com/inward/record.uri?eid=2-s2.0-85115119229&doi=10.1002%2fjev2.12148&partnerID=40&md5=0e034319c126cf547cd7722bcf051e4a,34533887,Review,Scopus
"Lewin S., Hunt S., Lambert D.W.",Extracellular vesicles and the extracellular matrix: A new paradigm or old news?,2020,Biochemical Society Transactions,48,5,"",2335,2345,,10.1042/BST20200717,https://www.scopus.com/inward/record.uri?eid=2-s2.0-85094935181&doi=10.1042%2fBST20200717&partnerID=40&md5=51c184dd08be445be0772664ac44f36b,33125481,Review,Scopus
"Santavanond J.P., Rutter S.F., Atkin-Smith G.K., Poon I.K.H.","Apoptotic Bodies: Mechanism of Formation, Isolation and Functional Relevance",2021,Subcellular Biochemistry,97,"","",61,88,,10.1007/978-3-030-67171-6_4,https://www.scopus.com/inward/record.uri?eid=2-s2.0-85103543805&doi=10.1007%2f978-3-030-67171-6_4&partnerID=40&md5=0ff4c20b463c93cb6ae03d07a60251d3,33779914,Book Chapter,Scopus
Hurbain I.,Microvilli-derived extracellular vesicles govern morphogenesis in Drosophila wing epithelium,2020,bioRxiv,"","","",,,,10.1101/2020.11.01.363697,"",,"",Chacko
"Liu X.-M., Ma L., Schekman R.",Selective sorting of micrornas into exosomes by phase-separated ybx1 condensates,2021,eLife,10,"",e71982,,,,10.7554/eLife.71982,https://www.scopus.com/inward/record.uri?eid=2-s2.0-85120168398&doi=10.7554%2feLife.71982&partnerID=40&md5=0f37ea03c3b0389294c0bfce76bbfb13,34766549,Article,Scopus
